URL,Keywords,Text
https://www.theguardian.com/lifeandstyle/2021/oct/16/blind-date-andrew-marta,"['table', 'blind', 'think', 'man', 'thing', 'watching', 'date', 'talk', 'film', 'didnt', 'ask', 'horror', 'marta', 'uk']","Marta on Andrew

What were you hoping for?

Romance, naturally. Failing that, someone I could have an interesting conversation with.

First impressions?

Positive, enthusiastic, chatty.

What did you talk about?

Postmortems, food, dogs, travelling, photography, dating, politics.

Any awkward moments?

Quite a few – all thanks to the guy at the nearby table, who decided to watch horror movie trailers without headphones on.

Good table manners?

Absolutely.

Q&A Want to be in Blind date? Show Blind date is Guardian Weekend magazine’s dating column: every week, two strangers are paired up for dinner and drinks, and then spill the beans to us, answering a set of questions. This runs, with a photograph we take of each dater before the date, in Guardian Weekend magazine (in the UK) and online at theguardian.com every Saturday. It’s been running since 2009 – you can read all about how we put it together here.



What questions will I be asked?

We ask about age, location, occupation, hobbies, interests and the type of person you are looking to meet. If you do not think these questions cover everything you would like to know, tell us what’s on your mind. Can I choose who I match with?

No, it’s a blind date! But we do ask you a bit about your interests, preferences, etc – the more you tell us, the better the match is likely to be. Can I pick the photograph?

No, but don't worry: we'll choose the nicest ones. What personal details will appear?

Your first name, job and age. How should I answer?

Honestly but respectfully. Be mindful of how it will read to your date, and that Blind date reaches a large audience, in print and online. Will I see the other person’s answers?

No. We may edit yours and theirs for a range of reasons, including length, and we may ask you for more details. Will you find me The One?

We’ll try! Marriage! Babies! Can I do it in my home town?

Only if it’s in the UK. Many of our applicants live in London, but we would love to hear from people living elsewhere. How to apply

Email blind.date@theguardian.com Was this helpful? Thank you for your feedback.

Best thing about Andrew?

He is very enthusiastic and easy to talk to.

Would you introduce him to your friends?

Sure, I don’t see why not.

Describe Andrew in three words?

Chatty, inquisitive, engaging.

What do you think he made of you?

Hopefully easy to talk to – and brave (I studied forensics and criminology at university). I didn’t have any romantic feelings for him, and towards the end of the date, I got the vibe that he didn’t think we were particularly compatible, either.

Did you go on somewhere?

No.

And … did you kiss?

No.

If you could change one thing about the evening what would it be?



We would have been more compatible: we didn’t have a huge amount in common, and didn’t get much beyond small talk, which I’m not a fan of.

Marks out of 10?

8 – Andrew is a lovely guy and good company. However, there was no romantic spark.

Would you meet again?

Yes, if we ran into each other, but just as friends.

Andrew on Marta

What were you hoping for?

My friend Sheyda to be vindicated in suggesting I did this.

First impressions?

She was trying to prevent either of us stepping on broken glass when the photographer’s light fell at our feet.

What did you talk about?

Polish blood sausage, a postmortem Marta attended as a student, and how expensive it would be to feed her dog Charlie fresh entrails every day.

Any awkward moments?

A man on the next table was watching a horror film loudly on his laptop. The constant screams were a tad awkward.

Good table manners?

Flawless! Marta even used a knife and fork to dissect her prawn bao.

Best thing about Marta?

Her no-nonsense approach to life.

Would you introduce her to your friends?

Sure, my friends are the best thing about me.

Quick Guide Saturday magazine Show This article comes from Saturday, the new print magazine from the Guardian which combines the best features, culture, lifestyle and travel writing in one beautiful package. Available now in the UK and ROI. Photograph: GNM Was this helpful? Thank you for your feedback.

Describe Marta in three words

Fearless, forensic, unflappable.

What do you think she made of you?

I dread to think. Too timid to ask a fellow diner to turn his volume down?

Did you go on somewhere?

We walked to the tube, thanked each other and said goodnight.

And … did you kiss?

No.

If you could change one thing about the evening, what would it be?

I’d have brought a pair of headphones for the horror film man.

Marks out of 10?

7.

Would you meet again?

You never know, maybe we’ll bump into each other at a Thai cookery course."
https://www.theguardian.com/environment/2021/oct/16/imperial-beach-california-exxon-mobil-climate-crisis,"['exxon', 'climate', 'oil', 'imperial', 'city', 'beach', 'citys', 'sued', 'went', 'dedina', 'evidence', 'mayor', 'industry', 'lawsuit', 'smalltown']","Serge Dedina is a surfer, environmentalist and mayor of Imperial Beach, a small working-class city on the California coast.

He is also, if the fossil fuel industry is to be believed, at the heart of a conspiracy to shake down big oil for hundreds of millions of dollars.

ExxonMobil and its allies have accused Dedina of colluding with other public officials across California to extort money from the fossil-fuel industry. Lawyers even searched his phone and computer for evidence he plotted with officials from Santa Cruz, a city located nearly 500 miles north of Imperial Beach.

The problem is, Dedina had never heard of a Santa Cruz conspiracy. Few people had.

“The only thing from Santa Cruz on my phone was videos of my kids surfing there,” Dedina said. “I love the fact that some lawyer in a really expensive suit, sitting in some horrible office trying to find evidence that we were in some kind of conspiracy with Santa Cruz, had to look at videos of my kids surfing.”

That’s where the laughter stopped.

The lawyers found no evidence to back up their claim. But that did not stop the industry from continuing to use its legal muscle to try to intimidate Dedina, who leads one of the poorest small cities in the region.

The mayor became a target after Imperial Beach filed a lawsuit against ExxonMobil, Chevron, BP and more than 30 other fossil-fuel companies demanding they pay the huge costs of defending the city from rising seas caused by the climate crisis.

Homes along the final stretch of Imperial Beach coast before reaching the border with Mexico. Photograph: John Francis Peters/The Guardian

Imperial Beach’s lawsuit alleges the oil giants committed fraud by covering up research showing that burning fossil fuels destroys the environment. The industry then lied about the evidence for climate change for decades, deliberately delaying efforts to curb carbon emissions.

The city’s lawsuit was among the first of a wave of litigation filed by two dozen municipalities and states across the US that could cost the fossil-fuel industry billions of dollars in compensation for the environmental devastation and the deception.

Dedina says his minority majority community of about 27,000 cannot begin to afford the tens of millions of dollars it will cost to keep at bay the waters bordering three sides of his financially strapped city. The worst of recent storms have turned Imperial Beach into an island.

One assessment calculated that, without expensive mitigation measures, rising sea levels will eventually swamp some of the city’s neighbourhoods, routinely flood its two schools and overwhelm its drainage system.

Imperial Beach’s annual budget is $20m. Exxon’s chief executive, Darren Woods, was paid more than $15m last year.

“We don’t have a pot to piss in in this city. So why not go after the oil companies?” he said. “The lawsuit is a pragmatic approach to making the people that caused sea level rise pay for the impacts it has on our city.”

That’s not how Exxon, the US’s largest oil company, saw it. Its lawyers noted that Imperial Beach filed its case in July 2017, at the same time as two California counties, Marin and San Mateo. The county and city of Santa Cruz followed six months later with similar suits seeking compensation to cope with increasing wildfires and drought caused by global heating.

Exxon alleged that the sudden burst of litigation, and the fact that the municipalities shared a law firm specialising in environmental cases, Sher Edling, was evidence of collusion.

Exxon filed lawsuits claiming the municipalities conspired to extort money from the company by following a strategy developed during an environmental conference at the Scripps Institution of Oceanography in La Jolla, 25 miles north of Imperial Beach, nine years ago.

The meeting, organised by the Climate Accountability Institute and the Union of Concerned Scientists, produced a report outlining how legal strategies used by US states against the tobacco industry in the 1990s could be applied to cases against fossil fuel companies.

Dedina was also targeted by one of the US’s biggest business groups at the forefront of industry resistance to increased regulation to reduce greenhouse gases, the National Association of Manufacturers, and a rightwing thinktank, the Energy & Environment Legal Institute.

Mayor Dedina looks out to sea. Photograph: John Francis Peters/The Guardian

The manufacturing trade group was behind the efforts to obtain data from Dedina’s phone and documents in 2018. In its public disclosure request to the mayor’s office, NAM called Imperial Beach’s lawsuit “litigation based on political or ideological objections more appropriately addressed through the political process”.

Exxon is attempting to use a Texas law that allows corporations to go on a fishing expedition for incriminating evidence by questioning individuals under oath even before any legal action is filed against them. The company is trying to force Dedina, two other members of Imperial Beach’s government, and officials from other jurisdictions, to submit to questioning on the grounds they were joined in a conspiracy against the oil industry.

“A collection of special interests and opportunistic politicians are abusing law enforcement authority and legal process to impose their viewpoint on climate change,” the oil firm claimed. “ExxonMobil finds itself directly in that conspiracy’s crosshairs.”

A Texas district judge approved the request to depose Dedina, but then a court of appeals overturned the decision last year. The state supreme court is considering whether to take up the case.

The target on Dedina is part of a wider pattern of retaliation against those suing Exxon and other oil companies.

In an unusual move in 2016, Exxon persuaded a Texas judge to order the attorney general of Massachusetts, Maura Healey, to travel to Dallas to be deposed about her motives for investigating the company for alleged fraud for suppressing evidence on climate change. The judge also ordered that New York’s attorney general, Eric Schneiderman, be “available” in Dallas on the same day in case Exxon wanted to question him about a similar investigation.

Healey accused Exxon of trying to “squash the prerogative of state attorneys general to do their jobs”. The judge reversed the deposition order a month later and Healey filed a lawsuit against the company in 2019, which is still awaiting trial.

But similar tactics persuaded the US Virgin Islands attorney general to shut down his investigation of the oil giant.

Patrick Parenteau, a law professor and former director of the Environmental Law Center at Vermont law school, said the attempt to question Dedina and other officials is part of a broader strategy by the oil industry to counter lawsuits with its own litigation.

“These cases are frivolous and vexatious. Intimidation is the goal. Just making it cost a lot and be painful to take on Exxon. They think that if they make the case painful enough, Imperial Beach will quit,” he said.

The city’s lawsuit claims it faces a ‘significant and dangerous sea-level rise’. Photograph: John Francis Peters/The Guardian

If the intent is to kill off the litigation against the oil industry, it’s not working. Officials from other municipalities have called Exxon’s move “repugnant”, “a sham” and “outrageous”, and have vowed to press on with their lawsuits.

Dedina described the action as a “bullying tactic” by the oil industry to avoid accountability.

“The only conspiracy is [that] a bunch of suits and fossil-fuel companies decided to pollute the earth and make climate change worse, and then lie about it,” he said. “They make more money than our entire city has in a year.”

The city’s lawsuit claims it faces a “significant and dangerous sea-level rise” through the rest of this century that threatens its existence. Imperial Beach commissioned an analysis of its vulnerability to rising sea levels which concluded that nearly 700 homes and businesses were threatened at a cost of more than $100m. It said that flooding will hit about 40% of the city’s roads, including some that will be under water for long periods. Two elementary schools will have to be moved. The city’s beach, regarded as one of the best sites for surfing on the California coast, is being eroded by about a foot a year.

Imperial Beach sits at the southern end of San Diego bay. Under one worst-case scenario, the bay could merge with the Tijuana River estuary to the south and permanently submerge much of the city’s housing and roads.

A view of the Tijuana River estuary. Photograph: John Francis Peters/The Guardian

The city has received some help with creating natural climate barriers. The Fish and Wildlife Service restored 400 acres of wetland next to the city as a national wildlife refuge which also acts as a barrier to flooding, and is expected to restore other wetlands together with the Port of San Diego. A grant is paying for improved equipment to warn of floods.

But that still leaves the huge costs of building new schools and drainage systems, and adapting other infrastructure. Dedina said that without the oil companies stumping up, it won’t happen.

“People ask, how did you go against the world’s largest fossil fuel companies? Isn’t that scary? No. What’s scary is coastal flooding and the idea that whole cities would be under water,” said the mayor.

“Honestly, bring it on. I can’t wait to make our case. I can’t wait to take the fight to them because we have nothing to lose.”

This story is published as part of Covering Climate Now, a global collaboration of news outlets strengthening coverage of the climate story"
