URL,Keywords,Text
https://www.vice.com/en_us/article/4avjed/daily-horoscope-october-16-2021,"['sagittarius', 'horoscope', 'sign', 'today', 'libra', 'venus', 'mercury', 'pisces', 'connects', '2021', 'retrograde', 'moon', '16', 'daily']","We’re eager to feel good as the moon in Pisces squares off with sweet Venus in Sagittarius at 4:59 PM—just try no to over-indulge! Exciting connections take place as Mercury retrograde in Libra connects with Venus at 9:24 PM. Surprises may arrive as the moon connects with Uranus in Taurus at 11:14 PM.

All times ET.

Aries

The moon in Pisces encourages you to step back from your everyday responsibilities and relax! The energy is cheerful and friendly as Mercury retrograde in Libra connects with Venus in Sagittarius. You might reconnect with an old friend.

Taurus

The moon in Pisces illuminates the friendship sector of your chart, making it an exciting time to connect with people! Mercury retrograde in Libra connects with your ruling planet Venus in Sagittarius, finding you having some intriguing conversations.

Gemini

The moon in Pisces finds you focused on your career! This is an exciting time to connect with the public. Your ruling planet Mercury is retrograde in Libra and it connects with Venus in your opposite sign Sagittarius, which could find you revisiting a conversation or reconnecting with someone.

Cancer

The moon in fellow water sign Pisces finds you in a philosophical mood today. Mercury retrograde in Libra mingles with sweet Venus in Sagittarius, finding you reflecting on your goals, desires, and values.

Leo

You’re reflecting on closure today as the moon moves through Pisces, but there’s also a cheerful energy in the air as Mercury retrograde in Libra connects with sweet Venus in fellow fire sign Sagittarius. It’s a lovely time to reconnect with friends!

Virgo

The moon in Pisces lights up the relationship sector of your chart, finding you learning more about your partner’s perspective. The energy is cheerful as your ruling planet Mercury retrograde in Libra mingles with Venus in Sagittarius. Some surprising conversations could take place as the moon mingles with Uranus.

Libra

You’re busy tackling your to-do list as the moon moves through Pisces, and you’re revisiting old conversations as Mercury retrograde in your sign, Libra, mingles with your ruling planet Venus in Sagittarius. A friendly energy flows!

Scorpio

The moon is in fellow water sign Pisces today, illuminating the romance and creativity sector of your chart! Mercury retrograde in Libra mingles with Venus in Sagittarius, which bodes well for communication—though things could be delayed.

Sagittarius

You’re focused on your home and family life today as the moon moves through Pisces. Chatty Mercury, which is retrograde in Libra, mingles with love and money planet Venus in your sign, which could find you reconnecting with people from the past.

Capricorn

The moon in Pisces lights up the communication sector of your chart, and it’s a busy day for ideation as messenger planet Mercury, which is currently retrograde, connects with Venus in Sagittarius. There may be some delays, but it’s an inspiring time to brainstorm and revisit old ideas!

Aquarius

The moon in Pisces lights up the financial sector of your chart today, finding you focused on themes like money, abundance, and security. Mercury retrograde in Libra connects with Venus in Sagittarius, which could find you running into old friends!

Pisces

The moon is in your sign today Pisces! It’s a wonderful time to pamper yourself. Mercury retrograde in Libra connects with Venus in Sagittarius, finding you revisiting conversations about values and desires."
https://www.vice.com/en_us/article/y3da9j/abercrombie-and-fitch-2000s-style,"['company', 'brand', 'abercrombie', 'wait', 'cool', 'told', 'way', 'went', 'look', 'brands', 'jeffries', '2000s', 'fitch']","By nature and design, the Rec Room team is always trying to find more ‘fits that hit in that intersection of mobster chic, 90s slacker, and Guy Fieri-cor. You know, the kind of button-downs that can say both, ""I know the way to Flavortown"" and ""meet me at the skate park."" We're partial to cardigans that look broken in by My Cousin Vinny, but were woven just yesterday. So when I recently came across this *chef’s kiss* bowling button-down, I thought for sure that it must be some Bodega-vetted streetwear brand. It was effortless. It was a balancing act of burgundy, creamy stripes, and relaxed cotton. It was the mid-century deli man shirt of my dreams—and it was made by… Abercrombie & Fitch?

“MA’AM! Where have I been?” I Slacked my coworkers about this plot twist; “Have you seen how good the stuff is on Abercrombie lately?” There wasn’t the same cringe, fake-outdoorsy-preppy energy on their website. Instead, it was replaced with an airy aesthetic that hit a sweet spot between Tony Soprano and a chill uncle from Connecticut. We went from “You can’t sit with us,” to full Gabagool Cool real fast:

The prep element is still there. We’re still standing on bedrock of argyle and houndstooth polos and pullovers, but in a way that feels far more Tommy-Hillfiger-meets-heritage-menswear than 2000s preppy. But it's clear that some major changes—and dare I say, upgrades—have been made since the brand's peak in the late 90s and subsequent downfall in the 2010s.

For starters, the brand has a far more inclusive size range (XXS-XXXL) than it did from 1992 to 2014, when former CEO Mike Jeffries was in charge, and its take on basics has branched out from Frat Boy Brad. “Abercrombie was once mediated through recognition of the brand, and the cultural cache it carried,” a company spokesperson told VICE about this shift, “[and] when Fran Horowitz became our CEO in 2017, she completely turned our company, and the Abercrombie brand, on its head.” In lieu of popped, fuschia polo collars, we now have “Vegan Leather Dad Coats” that lean into normcore aesthetics:

There are old school, long-sleeved rugby tees, and sweater vests just begging for a gorpcore bucket hat:

And don’t forget the smattering of neutral, soft (yet well-tailored) tracksuits that could give Skims a run for its money:

None of this is happenstance, of course. When Jeffries left Abercrombie, the company had some serious soul searching to do; the former CEO’s stewardship had helped turn the brand into an icon of 2000s style, for better and for (much) worse, through hyper-sexualized campaigns, a discriminatory “look policy,” and Jeffries’ proclamation that “a lot of people don’t belong [in our clothes], and they can’t belong. Are we exclusionary? Absolutely.""

I was a 2000s teenager once. Sometimes Gen Zers will ask me if things [points to Tara Reid on US Weekly circa 2007] were “really that rough?” I only went into an actual Abercromie store two or three times in my adolescence, and admittedly, my memories of life in the Fierce Cologne mists of Avalon aren’t great; there was a very real, unspoken social contract that this was where the Hot People came for a Tiësto sound bath, where employees must look like Laguna Beach extras, and that the customers must aspire to that standard. Which is rough, especially if you’re a string bean with a retainer.

Those were the Dark Ages. Everything the brand’s new team has done to move on from that weird period, explained a spokesperson, has been rooted in scaling back, becoming more inclusive, and celebrating what the brand did well in its infancy. When David Abercrombie founded the brand in 1892, it was an outdoor specialty retailer, and the company was all about providing quality camping, hiking, and fishing goods. By the early 20th century, it had established a well-respected brand identity around the ethos of escaping from the city for a jaunt in nature. It wanted young people, even those shopping in banal suburban malls, to feel like an elevated, city mouse in the country; its corduroy, knit, and flannel pieces felt cozy, classic, and as ready for a hike in the woods as they were for the dive bar. New Abercrombie is just Old Abercrombie, but better, because it’s forward-looking:

“We've worked to prove that Abercrombie is not the exclusionary brand of the past,” the Abercrombie rep told me, explaining that the designs we’re seeing now are the product of a new, more symbiotic relationship with consumers combined with the brand’s nod to its heritage pieces, which is a fancy way of saying: They’re giving the people what they want. “We’re dedicated to creating a sense of belonging vs. fitting in and [more] focused on how our customers feel rather than how they look.”

Are there still preppy fits? You bet. But we're happily nostalgic for these looks, even if we weren't big fans of the people who wore them in tenth grade."
https://www.vice.com/en_us/article/4avke9/netflix-fires-trans-employee-who-was-organizing-walkout-over-chappelle-special,"['company', 'fires', 'chappelle', 'employee', 'told', 'closer', 'special', 'following', 'trans', 'organizing', 'verge', 'netflix', 'fired', 'walkout']","Following the backlash to Dave Chappelle's comedy special The Closer, Netflix has fired a trans employee who was organizing an upcoming walkout, as reported by The Verge.

Advertisement

This is not the first employee who has been penalized by Netflix for their unhappiness with Chappelle's special. Terra Field, a trans software engineer, was suspended following a viral Twitter thread about The Closer, though she was later reinstated. The Verge reports that this newly fired employee is also trans, as well as black and pregnant. Netflix told The Verge that it fired this employee over suspicion of leaking internal metrics to the press.

Do you work at Netflix? We'd love to hear from you. Contact the reporter at gita.jackson@vice.com or via Signal at 267-713-9832 for extra security.

""We have let go of an employee for sharing confidential, commercially sensitive information outside the company,"" Netflix told The Verge. ""We understand this employee may have been motivated by disappointment and hurt with Netflix, but maintaining a culture of trust and transparency is core to our company."""
https://www.vice.com/en_us/article/k784jx/coolest-new-drops-collabs-october-2021-balenciaga-simpsons,"['yellowpop', 'dropped', 'balenciaga', 'rayban', 'wear', 'stagg', 'stuff', 'x', 'world', 'keith', 'haring', 'wild', 'coolest', 'week']","Welcome back to our weekly whirlwind of all the bangin'-est brand-new drops to grace our wild, wild world. Last week, we saw Guess return to its Anna Nicole Smith-worshipping roots, mid-century masterminds and Marimekko team up with Adidas for perfectly patterned athleisure wear, among other shiny new things.

This week, we see Deadhead kitchen accessories, Lisa Simpson walking the Balenciaga runway, and artist/producer Arca making futuristic aviators with Ray-Ban. It's a wacky week for drops and collabs, and we're all about it. Read on, pick up what looks good, and march forth into the autumn breeze.

Balenciaga x The Simpsons

We like that Balenciaga is kind of the weird internet troll of the luxury designer world, from their IKEA-inspired tote bag to their apocalyptic runway shows. As they continue to up the ante, they've pulled the Simpsons into the creative maelstrom, not only launching an entire animated catwalk presentation but also releasing this line of Simpsons swag featuring Homer, Marge, Bart, Lisa, and all the rest. Is it cheap? No. (It’s Balenciaga!) But it’s instantly iconic, and definitely goes in the collab hall of fame.

Grateful Dead x Hedley & Bennett

Us? Mad at how sk8r boi culture has weirdly become obsessed with the Grateful Dead? Nah. We, too, get down with spinning American Beauty while we light up some Dad Grass. In fact, we're downright delighted by cult-fave kitchen-wear brand Hedley & Bennett's new dancing-bear-emblazoned aprons, which are the perfect gift for the Deadhead in your life who also doubles as the barbecue stepdad and the DIY sourdough bread master.

Arca x Ray-Ban Studios

Electronic musician Arca is known for her solo work and production for Björk, Kanye West, Frank Ocean, and FKA Twigs, but this time she takes her avant-garde sensibilities to Ray-Ban's classic aviators. Only 55 pairs are being released online in each style, so make sure to grab yours and wear them to brunch in Bushwick after staying up all night.

Otherland's seasonal Gilded Collection

We don't want to sound, like, cheugy or anything, but even our cynical, atheist asses cannot resist the allure of cozy-weather scented candles. We're not going to run out and buy a bunch of Yankee pumpkin spice jawns or anything, but we can get down with Otherland's annual collection of seasonal scents, which always sells out, and this year includes Old Fashioned (""plum brandy, worn leather, dried fruit"") and Sacred Dusk (""palo santo, crimson incense, cypress bark""). No nutmeg here, just stuff to make chilling at home in the cold weather a little more romantic (and the easiest gift idea ever).

Great Jones x Stagg x Fellow

Those Fellow Stagg EKG gooseneck kettles have become nothing short of a status symbol, and the same could be said for the colorful sheet pans and cookware from Great Jones, so it makes sense that all the brands teamed up and made this broccoli-green electric kettle that will become the essential conversation piece of your kitchen counter.

Yellowpop x Keith Haring

OK, so Keith Haring's pop art has shown up everywhere the last few years, from bongs to Abercrombie shirts. But we've gotta say, we're feeling this collab with Yellowpop, the online store for affordable neon art. We'll take the classic Haring barking dog or the Twisted Man in our effortlessly chic loft apartment, and the LOVE sign in the photobooth of our (currently hypothetical) wedding, because c'mon, that's sweet.

Yellowpop x Keith Haring Barking Dog by Keith Haring LED neon sign $390 at Yellowpop $390 at Yellowpop

BRB, shuffling off into the October night to see who has the gnarliest Halloween decorations. Catch ya next week!"
https://www.vice.com/en_us/article/bvzw43/brandon-fellows-capitol-rioter-represented-self-in-court,"['represented', 'wrong', 'judge', 'justice', 'york', 'mcfadden', 'told', 'court', 'rioter', 'jan', 'admitted', 'went', 'fellows', 'capitol']","Demonstrators attempt to enter the U.S. Capitol building during a protest in Washington, D.C., U.S., on Wednesday, Jan. 6, 2021. (Eric Lee/Bloomberg via Getty Images)

Want the best of VICE News straight to your inbox? Sign up here.

A Jan. 6 Capitol rioter admitted to new crimes he hadn’t been accused of during a court hearing this week, serving as yet another reminder of why you should never try to act as your own lawyer.

Brandon Fellows, a 27-year-old from Albany, New York, was charged with multiple crimes, including obstruction of an official proceeding, which could land him in prison for up to 20 years. Fellows is accused of entering the Capitol building during the Jan. 6 riot and was caught on video smoking cannabis in Oregon Sen. Jeff Merkley’s office.

Advertisement

But on Tuesday, while testifying in his own bond hearing—he admitted to preparing for the wrong kind of hearing—Fellows accidentally described to the court actions that could constitute more crimes: He admitted to listing the phone number of a New York state judge’s wife as his own in an attempt to get the judge dismissed from the case, based on a supposed “loophole” he read about online, according to Courthouse News.

Fellows also admitted to asking his lawyer if he should do that in his federal case. Fellows testified that his lawyer told him: “You did not find a loophole, Brandon, I promise you. If you do this with Judge [Trevor] McFadden, you will be arrested.”

Perhaps unsurprisingly, Fellows’ motion to have his bond status revoked was denied. McFadden told Fellows that he admitted to obstruction of justice and perjury on the stand.

“You’ve admitted to incredible lapses of judgment here on the stand, not least of which was seeking to disqualify a New York state judge,” McFadden, a U.S. District Court judge nominated by former President Donald Trump, told Fellows.

“You’ve engaged in a pattern of behaviors that shows contempt for the criminal justice system, and I just have no confidence that you will follow my orders if I release you.”

Fellows is one of several accused Capitol rioters who’ve fired their lawyers and chosen to represent themselves in court. He did so despite being repeatedly warned by his former public defender and by McFadden that doing so was a bad idea. Fellows did it anyway.

“Although, as Justice Blackmun says, I may be a fool to represent myself, I am nowhere near as big a fool as Joe Biden,” Fellows told the court last month.

Fellows was allowed out on bail, but he was rearrested in July after prosecutors said rambling, obscene voicemail messages for his pretrial services officer and her mother."
https://www.vice.com/en_us/article/93ye7z/the-anti-vax-movement-cant-wait-for-kyrie-irving-to-be-its-idol,"['irvings', 'antivaccine', 'nba', 'health', 'conspiracy', 'week', 'wait', 'movement', 'vaccine', 'black', 'cant', 'idol', 'irving', 'kyrie', 'mandates', 'antivax']","The Brooklyn Nets and their star player, Kyrie Irving, have continued an awkward dance this week: Irving doesn’t want to get vaccinated against COVID-19, and Nets leadership desperately doesn’t want to keep him off the court long term. He can't play in New York due to local mandates, though, and the team is unwilling to let him play part-time. Meanwhile, the leading lights of the anti-vaccine movement are eagerly keeping tabs on the battle, clearly hoping Irving will be the figurehead for the battle against vaccine mandates they’ve been waiting for.

Advertisement

Irving has become the biggest COVID vaccine holdout in the NBA, but hasn’t outlined the specific reasons for his refusal. An incredibly embarrassing piece of stenography in The Athletic this week attempted to “clarify” his stance by speaking to people “with direct knowledge” of Irving’s decision-making. (These people sounded a lot like they work in public relations and were trying to spin his decision in a way that would not put the phrase “anti-vaccine” in headlines next to Irving’s name.) Those unnamed inside sources told the publication that Irving is “not anti-vaccine and that his stance is that he is upset that people are losing their jobs due to vaccine mandates...To him, this is about a grander fight than the one on the court, and Irving is challenging a perceived control of society and people’s livelihood,” in The Athletic’s tortured phrasing.

All of this is very exciting for the far right, as VICE News has reported: Characters like Candace Owens and Donald Trump Jr. have voiced their support for Irving’s refusal, even after excoriating other things he’s previously stood for, including support for Black Lives Matter and supporting the water protectors who stood against the Dakota Access Pipeline on Standing Rock Sioux land.

Advertisement

But it’s even more thrilling for the anti-vaccine movement and the broader movement of health conspiracy theorists around them, who would like more basis for their continued insistence that COVID vaccine mandates are an infringement on the public’s civil rights and/or a globalist plot to enslave the human race. If Irving were benched all season for a team with championship aspirations, it would make for a very convenient talking point, which is why, across fringe publications and toxic Telegram channels, his decision-making is being tracked and supported. The author and health conspiracy theorist David Avocado Wolfe called Irving “the smartest guy in the NBA,” while the pseudo-scientific “health” site Health Impact News, which frequently traffics in conspiracy theories and bogus claims, praised Irving for “giving up over $100 million” to refuse the shot. (That’s not correct, but the decision is an expensive one: Irving is ineligible to play as long as he refuses the shot, and reportedly stands to lose $380,000 for missing a pre-season game. He may lose up to $15 million this season, CNN reports.)

Health Impact News editor Brian Shilhavy likened the NBA to “slave masters” and wrote, “The real reason the NBA and Nets are making this decision, is that they cannot afford the PR nightmare that would ensue for allowing an 'anti-vaxxer' to tour to other NBA cities and become a beacon of light for those who refuse to bow to the Globalists and their eugenics agenda.”

Advertisement

Irving’s own silence about why he doesn’t want to get vaccinated has allowed various people to pin their own motivations onto his decision. In a lengthy Instagram live video, Irving offered some general reasoning, involving an opposition to vaccine mandates and to being told what to do with his own body.

“Pay attention to what’s going on out in the real world,” he said, in part. “People are losing their jobs to these mandates. People are having to make choices with their own lives, which I respect.” He implied that he’d been told he’d be able to get an exemption, adding “What would you do? If you felt uncomfortable going into the season when you were promised that you would have exemptions or that you didn’t have to be forced to get the vaccine?” He added, a moment later: “This is one body that I get here, one God body that I get here. And you’re telling me what to do with my body?”

""It's not about being anti-vax or about being on one side or the other. It's about being true to what feels good for me,"" he said. (Refusing to take a safe, effective vaccine at a cost of millions of dollars and making an enormous public show of it seems, of course, to meet a reasonable definition of side-taking and being anti-vax.)

Advertisement

The site Green Med Info, another hub for health conspiracy theories, shared a link to a summary of Irving’s Instagram comments on Telegram, praising them as “EPIC.”

This isn’t Irving’s first foray into out-there ideas: He previously generated controversy for suggesting on a podcast that the Earth might be flat, before apologizing. This time, Irving seems to be taking some ideas from a fringe Instagrammer, as Rolling Stone’s Matt Sullivan reported, “liking Instagram posts from a conspiracy theorist who claims that ‘secret societies’ are implanting vaccines in a plot to connect Black people to a master computer for ‘a plan of Satan.’” (The idea that vaccines are a “death plan” or a depopulation scheme for Black people is something that the Nation of Islam began promoting in the 1960s. While vaccine skepticism is not generally more common in Black communities, both Black and Latinx people are less likely to be vaccinated against COVID-19 and more likely to be hospitalized with the disease. That’s due in part to a suspicion of the medical establishment because of the United States’ toxic legacy of medical racism and experimentation against those populations.)

A Black conspiracy influencer named Behizy, who’s recently spent more time trafficking in false claims on Gab and Telegram that the 2020 presidential elections were stolen, offered more praise for Irving, writing, “If Kyrie Irving’s teammates have any integrity and honor left, they should join him. #HoldTheLineKyrie.”

The phrasing “Hold the Line” is not coincidental; it’s also what anti-vaccine personalities have been urging Southwest pilots to do. The airline canceled thousands of flights this week citing bad weather and staffing issues; as the Associated Press reported, conservative politicians and anti-vaccine groups quickly began claiming that the airline’s staff were staging a “sickout” protest over vaccine mandates. (Southwest denies this, though how convincing you find the denial is possibly a matter of perspective.) The hashtag #holdtheline quickly became a rallying cry to urge them to refuse to get vaccinated.

Chaos, strife, and division over vaccine requirements are ultimately what the anti-vaccine movement wants, and high-profile dissenters like Irving serve those goals. This is perhaps why it's focusing less on the comments of Irving’s teammates who got vaccinated without incident and quietly moved on to doing their jobs, without added risk to each other, their staff, or their fans. That includes James Harden, who said in a press conference this week, “Kyrie believes in his beliefs, and he stands firm and strong on that. And for us, we respect it. We all love Ky. But as far as us, we have a job to do.”"
