URL,Keywords,Text
https://www.wired.com/2021/08/geeks-guide-time-travelers-viruses/,"['trying', 'travelers', 'traveler', 'viruses', 'heaven', 'worried', 'lot', 'empire', 'space', 'jesus', 'carrier', 'sort']","Michael Moorcock’s classic 1969 novel Behold the Man is about a character named Karl Glogauer who travels back in time to witness the crucifixion. Historian Richard Carrier says that the novel presents a fairly accurate portrait of first-century Judea.

“[Moorcock] is not trying to describe every detail of life, he’s not trying to create color—which is where all the mistakes could arise,” Carrier says in Episode 479 of the Geek’s Guide to the Galaxy podcast. “He’s describing scenes so simply, his narrative is so minimalist in the way it’s constructed, that he escapes a lot of those problems. So it becomes a plausible story in context, because there aren’t a lot of places he butts up against history and makes a mistake.”

In Behold the Man, Karl is able to locate Jesus fairly quickly. But Carrier thinks that in reality, finding Jesus would be a real challenge, since all the information we have about him comes from highly unreliable sources. He says that finding any particular person in ancient Jerusalem, a city of more than 70,000 people, could take a lot of time and effort.

“I’d want to sit around and wait until someone’s talking about this particular prophet,” he says. “I would try to have inroads to all the local sects and see what’s brewing, and try to figure that out. And I would use it as double duty as a historian to just document all kinds of cool stuff that’s unrelated to Jesus while I’m there, and then maybe leave it in a time capsule—bury it in a pot so it could be like a new Nag Hammadi discovery, all my time traveler books about the era.”

In general Carrier thinks that science fiction authors tend to underestimate the difficulties a time traveler would face surviving in the past. “It would take you a while to get settled,” he says. “You’d have to figure out the customs, the language, how to get money so you could eat. There are a lot of things you’d need to sort out, because it’s basically an adventure mission. You’re basically going into the Congo with whatever’s on your back, and then you need to get your base of operations and figure stuff out, and then you can relax and wait for whatever scene or event you’re trying to watch.”

One of the biggest threats would be viruses, an issue that’s seldom tackled in science fiction. “The problem with time travel is that if you went back in time, you would probably wipe out the whole population then, and they would probably kill you within months with viruses that you have no immunity to,” Carrier says. “So note to time travel authors: You have to come up with a universal immunity so that the time traveler who goes back is not bringing viruses that everybody is not immune to, and is immune to viruses that his body has never encountered.”

Listen to the complete interview with Richard Carrier in Episode 479 of Geek’s Guide to the Galaxy (above). And check out some highlights from the discussion below.

Richard Carrier on time travel:

“If I had to go into the past, and it had to be the Roman Empire, I would probably pick right after the victory of Vespasian, because from everything I’ve read, Vespasian seems a very pragmatic fellow. I feel like I could go there and convince him to institute a proper constitutional government, in exchange for certain technologies of empire, like the railroad, for instance, and the printing press. Possibly gunpowder. That wouldn’t fix every problem—it would turn the Roman Empire into the British Empire, basically, which is a slight improvement, but still pretty far back—but if we could get that constitutional government set in, we could have social progress as well as scientific and technological progress a thousand years earlier, and we could bypass the hell of the Middle Ages.”

Richard Carrier on the Babylonian Talmud:

“We have the complete Babylonian Talmud, and it does mention Jesus and Christians, but weirdly it always places the story of Jesus’ execution a hundred years earlier. It puts it right after the death of Alexander Jannaeus, in some sort of Hellenized Jewish context. [Jesus] is stoned by the Jewish authorities—there are no Romans, because Romans aren’t there yet—he’s stoned by Jewish authorities in Joppa rather than outside Jerusalem. So there’s this whole different narrative. He’s placed in a completely different century. And it’s definitely the same guy—Jesus of Nazareth, mother was Mary, the whole thing. … It’s usually just dismissed as some sort of change or error or whatever, but it’s actually hard to explain if there was an actual historical Jesus.”

Richard Carrier on his book Jesus from Outer Space:

“The first Christians were preaching that Jesus was a space alien, he was like Klaatu from The Day the Earth Stood Still. That was their view. You really don’t understand the origins of Christianity if you don’t understand this. There’s a lot of pushback against it, because of the anachronistic belief that he didn’t come from ‘outer space,’ he came from ‘heaven.’ But back then that was outer space. The idea that heaven was another dimension—that you can’t get to it in this universe, it’s somewhere else—that idea is modern. That did not exist back then. Back then, heaven was literally up there. You could point to it. If you had a telescope you could watch it, if you had a rocket you could go to it. That was what heaven was.”

Richard Carrier on hallucinations:

“These [early Christian] sects, especially these fringe sects, were very obsessed with having visions, so they were looking for ways to do it. A lot of them might have attracted schizotypal persons, who are persons who don’t have schizophrenia, but are highly prone to hallucinate. … We have a very hallucination-hostile culture now, where a hallucination is immediately medicalized as a mental disorder, it’s not respected as real, and so on. This is a radically different culture that we live in now from what was going on back then. In that culture, hallucinations were respected as real visions, and you could actually move up in the ranks of a religious movement the more—and more fascinatingly—you hallucinated encounters with the divine.”

More Great WIRED Stories"
https://www.theguardian.com/business/2021/oct/16/bill-for-family-days-out-at-some-uk-attractions-almost-doubles,"['compared', 'doubles', 'days', 'ticket', 'visit', 'increase', 'sites', 'english', 'heritage', 'value', 'attractions', 'bill', 'cost', 'uk', 'family']","The cost of visiting some of Britain’s best-known visitor attractions has almost doubled over the last five years, according to researchers who named English Heritage sites as the worst offenders.

Overall the cost of family days out has risen by a third, according to the Play Like Mum website, which compared the cost of visiting popular sites five years ago with today’s prices.

In the summer of 2016, it cost £16.60 for a family to visit Carlisle’s medieval castle compared with £32.80 now. Another English Heritage site, Tintagel Castle in Cornwall, recorded a similarly steep increase , with a family ticket rising from £22.60 to £40.80.

However, these destinations both look good value when compared with some of the others surveyed by the website. A family planning to visit Portsmouth Historic Dockyard and HMS Victory now have to find the kind of sum that would have made Nelson avert his gaze – £120. In 2016, a family ticket cost £68.

The research found that it now costs 43% more to visit the Tower of London – up to £82. There has been an increase in the cost of admiring Bath’s Roman baths that would have made even Caesar blush – a 75% increase since 2016, to £76.

Andrew Coplestone, Play Like Mum’s founder, says: “Some of these huge increases mean that some families may not be able to afford local days out with their children, especially as a single parent.”

A spokesperson for English Heritage says many of its sites have been transformed over the last five years, with extra value added.

“At places like Tintagel Castle in Cornwall there has been the installation of a dramatic footbridge, a revamped exhibition and outdoor interpretation – at less than £9 a person for a family ticket, it offers good value and is competitively priced with other major attractions.”"
https://www.theguardian.com/business/2021/oct/15/how-covid-spread-fear-of-globalisation-and-threatens-a-new-world-order,"['threatens', 'globalisation', 'fear', 'pandemic', 'system', 'shock', 'covid', 'spread', 'order', 'world', 'china', 'global', 'trade', 'products', 'economic', 'supply']","When Xi Jinping promised the world’s movers and shakers in January 2017 that China would champion globalisation, it looked as if the baton of global economic leadership was being picked up seamlessly by Beijing as Donald Trump prepared to usher in an era of American isolationism.

Almost five years later a new world order has emerged, but it is not the one China’s president and others gathered in Davos that day seemed to have in mind.

Instead of a continuation of the post-cold war era of growth underpinned by free trade, the world faces a fractured economic system where the post-pandemic supply shock and mistrust bred by the virus pushes countries towards an autarkist impulse for self-sufficiency.

Autarky is a Greek word meaning “self-reliance” and was popularised as shorthand for economic nationalism in the 19th century. It gained some credence as an economic model when the young Soviet Union in effect shut itself off from world trade, and the nationalist impulse towards self-sufficiency appealed to Hitler. It also flourished in the postwar world, especially in Africa, though the creed of globalisation has left few examples outside North Korea.

There were already some signs of nationalist-driven challenges to the prevailing system exemplified by Brexit, the rise of Trump, and a growing suspicion that China was not prepared to play by the rules set by the US and its proxies.

The arrival of the coronavirus pandemic has accelerated these trends, experts believe.

Maintenance of a high voltage converter station in Xuancheng. Photograph: AFP/Getty Images

Evgeny Postnikov, a senior lecturer in international relations at the University of Melbourne, says the pressures of the pandemic have delivered a stark realisation about how much countries rely on imports and products enmeshed in the global supply chain.

From the initial scramble to protect production of face masks in France, to the careful control of vaccine technology, the pandemic has thrown up countless examples of how quickly the existing world order began to buckle under the domino effect of nationalistic urges.

“Governments can’t be relying on strategic competitors to supply crucial goods and services,” Postnikov says. “Trade and security were seen differently but now both are treated as high politics. That is why autarkist push is not going away. If anything it will get stronger, and that is quite worrying.”

The power cuts across northern China in recent weeks have led Beijing to accelerate its drive to become more self-sufficient. After hopeful signs that China would wean itself off fossil fuels by shutting hundreds of coal-fired power stations, the hint this week from Beijing of a rethink on slashing emissions is a crushing blow to global cooperation on the climate crisis.

Under the “Made in China” policy launched in 2018, China is already trying to develop more capacity in semiconductors, the lifeblood of consumer goods ranging from Teslas to toasters, and PlayStations to printers, as well as other strategic products. The country’s belt and road initiative is binding dozens of nations in Asia, Africa and Europe into Beijing’s economic orbit.

India, which was slow to begin dumping its corporatist economic model in favour of a more global-facing one, has also given a name for its plan to head back in the opposite direction: Atmanirbhar Bharat. This translates as “self-reliant India” and is designed, in the words of the foreign minister, Subrahmanyam Jaishankar, to extricate the country from “global commitments not to our advantage”.

Hence India’s withdrawal last year from the pan-Asian Regional Comprehensive Economic Cooperation pact (Rcep) over concerns that its huge agricultural sector would be sacrificed on the altar of free trade.

In Britain the sudden loss of cheap migrant labour means employers are looking again at their business models. On Wednesday Britain’s “chicken king”, the head of the country’s largest poultry producer, called for a total rethink of how food is produced. “Three months ago I was vocal about the government needing to help with labour issues,” said Ranjit Singh Boparan, the owner of 2 Sisters Food Group, which processes 10 million chickens a week. “I’ve now come to the conclusion that in reality it can’t fix all the problems.”

He says he no longer believes the solution is more visas for foreign workers: instead, the price of food will have to rise in line with the cost of producing it.

“We need to work with our supply chains and customers to solve these issues. But it will come at a cost. I need to invest, increase automation and make our factories more welcoming for new recruits,” he said.

The supply shock has “thrown sand in the gears of the world economy”, according to George Magnus, an independent economist and associate at the China Centre, at Oxford University. “It is hard to disentangle structural issues around the supply chain with the process of globalisation. Everything is more complicated and more expensive. It looks like a symptom of a decomposing global economy.”

Farming near a Hubei power station. Photograph: Getty Images

He says the world economy should begin to realign by next year but that the current crisis could have a “corrosive impact in the medium term” as companies seek to diversify from sole-source supply and secure strategically important products such as semiconductors, batteries and energy.

More than 80% of industries have experienced supply chain disruptions because of the pandemic, according to a report by the consultancy Deloitte, and about 75% of companies have brought forward plans to repatriate manufacturing from overseas by building smart factories closer to home.

A study by the Reshoring Initiative, in the US, has forecast that the country will add 224,213 jobs from abroad in 2021, an increase of 38% on 2020. Investment in strategic products such as semiconductors, electric vehicle batteries and pharmaceuticals are driving the changes, the report says.

There are similar moves in the UK, where a report predicts factories could make almost £5bn more goods in 2021 as the pandemic and Brexit prompt businesses to bring home production.

The rising cost of labour in countries such as China have added pressure on corporations for a rethink of the way their products are made. For example, labour costs are now cheaper in Mexico than in China and short-circuiting the economic model of the latter as the workshop of the world while providing a powerful incentive for American producers to set up shop closer to home.

Another problem undermining the global system is that the controversy over the origins of coronavirus has poisoned relations already struggling with battles over tariffs, Hong Kong, and alleged Chinese infiltration of foreign communications networks through the state champion Huawei.

“The virus has bred mistrust,” says Magnus, “and the division sown by this has been a shock for China. It’s not going to be easy to make good because public attitudes in the west now show a high level of antagonism towards China. I don’t know what it would take to come back from that.”

Britain’s withdrawal from the EU was a shock to the world’s trading system, and when Trump took power days after that Xi speech at Davos one of his first acts was to pull out of the Trans-Pacific Partnership trade deal. It could be a sign of things to come as countries “decouple” from the globalised system.

“We’re not going to end up with lots of North Koreas – the autarkist state par excellence,” says Postnikov. “But what we will see I think is a world of smaller regional blocs where there are shorter supply chains. The TPP, Rcep, Brexit – it’s all unilateralist, whereas before these problems were viewed through a multilateral lens.”"
https://www.theguardian.com/business/live/2021/oct/15/ftse-100-pandemic-high-uk-haulage-cabotage-changes-insolvencies-economy-growth-business-live,"['workers', 'rise', 'pandemic', 'wages', 'fca', 'ftse', 'department', 'public', 'pay', 'economy', 'hits', 'set', 'early', 'whitehall', 'insolvencies', 'leaving', 'budget', 'happened', 'high', 'sector']","11:25

Rishi Sunak is set to confirm that the “pause” on public sector pay that affected 2.6 million teachers, police and civil servants will be lifted in April, as the economy bounces back from Covid.

The chancellor imposed the freeze last November and it came into force in April. At the time, he said it was unfair for public sector workers to get a rise while many of their private sector counterparts were being furloughed or losing their jobs.

With wages in many sectors rising, and the prime minister using his party conference speech to highlight the prospects for a “high-wage economy”, Treasury sources said that argument no longer applied.



However, each Whitehall department will have to fund any pay increases from within its own budget, and TUC analysis shows that the pay of many public sector workers has fallen significantly in real terms after years of tight settlements.

Sunak will set out the funding for each individual department as part of a three-year spending review, which he will deliver alongside the budget on 27 October.

Here’s the full story:"
https://www.theguardian.com/commentisfree/2021/oct/15/tory-austerity-deaths-cut-human-cost-cruel-policy,"['2010', 'health', 'care', 'nhs', 'cuts', 'spending', 'worse', 'day', 'million', 'tory', 'social', 'toynbee', 'deaths', 'austerity', 'misery', 'polly', 'caused']","Deaths are what can be counted most easily – bodies can’t be hidden from the statisticians or denied by those responsible for the figures. It was predictable, and predicted, that many more would die when the government of David Cameron, George Osborne and Nick Clegg applied a brutal tourniquet to public spending in 2010. Warnings at the time were shrugged off as shroud-waving and scaremongering.

But new research from University of York’s renowned Centre For Health Economics only confirms the inevitable consequence: an extra 57,550 people in England died in the five years from 2010, a level of deaths beyond the statistically normal. Life expectancy improvement slowed, which was directly “attributable to spending constraints in the healthcare and social care sectors”, according to lead researcher Prof Karl Claxton.

But below the radar, below the level of all these countable death certificates, consider the suffering imposed on millions by withdrawing care, support and income. Austerity didn’t just cut lives short: it scarred people, especially many children and young people brought up in extreme poverty. This effect is well researched and thoroughly proven.

By 2010, the Labour government had lifted a million children and a million pensioners out of poverty. I once chronicled Labour’s social programmes and their effects from 1997 to 2010. Spending on the NHS rose by an average of 7% a year, more than since it was founded in 1948. Waiting lists, which had been the NHS rationing system, fluctuating with spending, were reduced to near zero by 2010 for the first time. Though social care was never resolved, local authorities had more money to cover its rising costs. After 2010, the NHS suffered the leanest years in its history. Delaying operations adds to risk – and the great rise in the waiting lists to more than 4 million people in England happened well before the pandemic.

Cut care, and people suffer: Age UK says that compared with before 2010, 1.4 million fewer frail people are getting any help at all, as the eligibility criteria tighten year after year. Many more were bound to die. In March 2019 I spent the day at an old people’s day centre in Hastings. This was the day before it closed, becoming the seventh such centre to do so in the town; more have gone since. It was absolutely clear to the devoted staff that many of those frail old people would suffer and probably die sooner, without daily hot meals and supervised medicines – but, above all, without company and friendship. Some had been friends for years but now they were losing their day centre and the minibus to bring them together; they were to be left home alone, some with no care. Are their names among these excess deaths?

That story is in the book I co-wrote with David Walker, The Lost Decade, 2010-2020, in which we detailed the losses deliberately inflicted by government cuts. Consider the stark cruelties imposed by the deepest benefit cuts. Look at the bedroom tax, trying to force people out of family homes if they had a spare room. One of the first cases we recorded was that of a family whose 10-year-old child had died recently. The benefit cap and the two-child benefit limit has had the most severe effect on families with three or more children, many of whom never expected to rely on benefits but suffered some of life’s unexpected disasters – which is what social security is supposed to defend against.

Separate research published in the Lancet today from Imperial College shows that life expectancy has fallen since 2010 in the poorest places in Blackpool, Liverpool, Leeds, Manchester and Newcastle. That is what cuts do. Look at the loss of services for mental health, homelessness and addiction. These pick up life’s fallers, rescuing them before it’s too late. Did anyone think deaths wouldn’t follow?

Then there was the abrupt closure of most of Labour’s 3,500 Sure Start children’s centres – the greatest social vandalism of the decade. Here, right from the birth of a child, families could be helped early. Here were centres of support with midwives, health visitors and mental health teams – every service within pram-pushing distance. It was a network of help, a haven for victims of domestic abuse, an early warning for any delayed development in a child. Not only has most of that gone, but health visitors have been cut right back. There is fewer than one school nurse for every 10 schools in England, yet these are vital support for children seeking help. Schools have lost staff, their funding per pupil now below 2010 levels.

Next week the chancellor stands up to announce his budget and three-year spending review. The Institute for Fiscal Studies warns us to expect another turn of the screw – a new era of austerity – with cuts in everything but the NHS and schools. This is likely to be as socially and economically damaging as George Osborne’s disastrous policies. No doubt a smattering of small sums will seek to disguise the axe that is about to fall, yet again, on the most vulnerable. Local councils will be hit hard again, along with prisons, courts, further education and everything needed to reach the net-zero climate target. Forget “levelling up”: just to get back to 2010 levels would take very heavy lifting after such devastation to successful social programmes.

Taxes are higher than since the second world war, and yet the UK still remains lower taxed than equivalent EU countries. There are always choices to be made in taxing and spending, but in the last decade Britain has chosen the most damaging path, with austerity harming the economy as well as the social fabric. That looks set to be repeated, no lessons learned – and more excess deaths are entirely predictable."
