URL,Keywords,Text
https://www.theguardian.com/environment/2021/oct/16/boris-johnson-climate-credibility-at-stake-cop26-summit,"['johnsons', 'climate', 'stake', 'boris', 'net', 'treasury', 'review', 'credibility', 'runup', 'strategy', 'hydrogen', 'fossil', 'cop26', 'zero', 'green', 'summit']","Boris Johnson faces a significant test of his leadership before the Cop26 climate summit as the chancellor and business secretary are at war over the imminent plan for reaching net zero carbon dioxide emissions.

The government is poised to publish its long-awaited net zero strategy on Monday, setting out how the UK will meet its targets to cut CO 2 emissions by 78% by 2035 and reach net zero by 2050. This will also include the heat and buildings strategy for insulating draughty homes and phasing out gas boilers, along with a massive expansion of offshore wind, and building electric vehicle charging networks.

But green campaigners are concerned that the strategies, put forward by Kwasi Kwarteng are being hamstrung by opposition from Rishi Sunak, who is refusing to provide adequate funding.

Failure to put forward a viable and well-funded blueprint for reaching net zero would destroy the UK’s credibility at a crucial time, campaigners have said, just weeks before the UN Cop26 climate talks, which begin in Glasgow at the end of this month.

Ed Matthew, campaign director at green thinktank E3G, said: “To achieve an ambitious outcome at Cop26, the government has to lead by example. If they don’t have their own house in order on how to reach net zero, how are they going to persuade the rest of the world to get on track? The whole diplomatic strategy is absolutely dependent on having a credible plan in place in the UK.”

Kwarteng has spoken publicly in favour of decarbonising electricity generation by 2035, and is pushing net zero behind the scenes. This is a new departure for the business secretary, who comes from a strongly free-market viewpoint, as one of the authors of Britannia Unchained. But insiders claim the pandemic has changed his outlook, and that he has undergone elements of a “green” conversion – though he is also still intent on licensing new oil and gas in the North Sea.

“With the pandemic and the energy crisis, he is seeing a need for government intervention,” said one close observer. “Energy security is now a key theme, and building renewables can help with that.”

But Sunak, who controls the purse strings, is understood to be strongly opposed to devoting new cash to the climate effort. He was notably silent on the climate, net zero strategy and Cop26 in his speech to the Tory party conference earlier this month.

“It’s astonishing that he did not mention climate change: the single greatest threat the UK economy is facing, and with Cop26 approaching,” said Matthew. “Without the Treasury, we can’t be on track for net zero, because we need not just the policies but investment – this is the litmus test.”

A government source denied any split and told the Guardian: “This is a whole government approach: every department has signed up to net zero and the prime minister is the biggest proponent of this agenda. The preparation of the strategy with the Treasury has been smooth.”

The Treasury is also due to publish on Monday its own net zero findings, in the form of a review that is expected to set out the costs of reaching net zero. The Treasury net zero review is controversial among green experts, as the Guardian understands it will not take account of the many benefits of cutting emissions, including green jobs, lower energy bills and health improvements from cutting air pollution, as well as reducing the impacts of extreme weather.

“It’s as if the Stern review never happened,” said one expert, referring to the landmark 2006 study by climate economist Nicholas Stern, which found the short-term costs of cutting emissions were far outweighed by the economic benefits. “They have stuck to their old pre-Stern models of cost.”

Green campaigners believe the Treasury review will be seized on by climate sceptics in the Tory ranks. They are also concerned that lobbying by the fossil fuel industry has persuaded the government to make hydrogen a leading part of its net zero strategy. That would be a mistake, they argue, as some forms of hydrogen are not low-CO 2 , but require fossil fuels to be converted into hydrogen and the resulting CO 2 stored, in contrast with genuine green hydrogen methods, by which hydrogen is manufactured using renewable energy.

“Hydrogen boilers are greenwash,” said Matthew. “They will massively increase energy bills. If they’re considering hydrogen, that’s a bad sign.”

Kat Kramer, global climate lead at the charity Christian Aid, said: “The government is currently promoting false solutions that effectively subsidise the fossil fuel industry. It is crazy that they plan to use taxpayers’ money to promote hydrogen made from fossil gas rather than renewables, and for capturing carbon from burned fossil fuels and storing it underground.”

A Treasury spokesperson said: “We are absolutely committed to meeting our world-leading climate commitments and the prime minister’s 10-point plan set out £12bn of investment for green industries. “

But they stressed the importance of private sector investment, adding: “Government alone cannot achieve net zero, which is why we are working with the private sector to boost investment and leading the world in green finance.”"
https://www.theguardian.com/science/2021/oct/16/nasas-lucy-rockets-into-sky-with-diamonds-explore-asteroids,"['explore', 'solar', 'spacecraft', 'nasa', 'orbit', 'starr', 'sky', 'past', 'rockets', 'diamonds', 'asteroids', 'lucy', 'nasas', 'trojan']","A Nasa spacecraft named Lucy has rocketed into the sky with diamonds on a 12-year quest to explore eight asteroids.

Seven of the mysterious space rocks are among swarms of asteroids sharing Jupiter’s orbit, thought to be the pristine leftovers of planetary formation.

An Atlas V rocket blasted off before dawn on Saturday, sending Lucy on a roundabout orbital journey spanning nearly 4bn miles (6.3bn km). “I’m just elated,” Nasa’s associate administrator, Robert Cabana, said after liftoff. “This is the coolest darn mission.”

Lucy is named after the 3.2m-year-old skeletal remains of a human ancestor found in Ethiopia nearly half a century ago. That discovery got its name from the 1967 Beatles song Lucy in the Sky With Diamonds, prompting Nasa to send the spacecraft soaring with band members’ lyrics and other luminaries’ words of wisdom imprinted on a plaque. The spacecraft also carried a disc made of lab-grown diamonds for one of its science instruments.

In a prerecorded video for Nasa, the Beatles drummer, Ringo Starr, paid tribute to his late colleague John Lennon, credited for writing the song.

“Lucy is going back in the sky with diamonds. Johnny will love that,” Starr said. “Anyway, if you meet anyone up there, Lucy, give them peace and love from me.”

00:31 'Johnny'll love that': Ringo Starr wishes Nasa Lucy mission well – video

The paleoanthropologist behind the discovery of the Lucy remains, Donald Johanson, said he was filled with wonder about this “intersection of our past, our present and our future.”

“That a human ancestor who lived so long ago stimulated a mission which promises to add valuable information about the formation of our solar system is incredibly exciting,” said Johanson, of Arizona tate University, who travelled to Cape Canaveral in Florida for the launch.

Lucy’s $981m (£715m) mission is the first to aim for Jupiter’s so-called Trojan entourage: thousands – if not millions – of asteroids that share the gas giant’s expansive orbit around the sun. Some of the Trojan asteroids precede Jupiter in its orbit, while others trail it.

Despite their orbits, the Trojans are far from the planet and mostly scattered far from each other. So there is essentially zero chance of Lucy getting clobbered by one as it swoops past its targets, said Southwest Research Institute’s Hal Levison, the mission’s principal scientist.

Lucy will swoop past Earth next October and again in 2024 to get enough gravitational oomph to make it all the way out to Jupiter’s orbit. On the way there, the spacecraft will zip past asteroid Donaldjohanson between Mars and Jupiter. The aptly named rock will serve as a 2025 warmup act for the science instruments.

Drawing power from two huge circular solar wings, Lucy will chase down five asteroids in the leading pack of Trojans in the late 2020s. The spacecraft will then swoop back toward Earth for another gravity assist in 2030 that will swing it back out to the trailing Trojan cluster, where it will zip past the final two targets in 2033.

Lucy will pass within 600 miles of each target; the biggest is about 70 miles across.

“Are there mountains? Valleys? Pits? Mesas? Who knows? I’m sure we’re going to be surprised,” said Hal Weaver of Johns Hopkins University, who is in charge of Lucy’s black-and-white camera. “But we can hardly wait to see what ... images will reveal about these fossils from the formation of the solar system.”"
https://www.theguardian.com/world/2021/oct/16/four-die-after-violence-erupts-at-hindu-festival-in-bangladesh,"['attacked', 'cumilla', 'die', 'violence', 'religious', 'incident', 'minister', 'bangladesh', 'hindu', 'erupts', 'temples', 'holy', 'festival']","Deadly communal violence has broken out in Bangladesh after allegations of the desecration of an Islamic holy book led to several Hindu temples being attacked and police opening fire on a crowd, leaving at least four people dead.

The government deployed paramilitary troops to 22 districts after religious tensions and violence broke out in the city of Cumilla on Wednesday.

It was sparked by videos and allegations that spread across social media that a Qur’an, the Muslim holy book, had been placed on the knee of a statue of the Hindu god Hanuman, in a shrine set up for the Hindu holy festival of Durga Puja.

Mobs of more than 500 people gathered in Cumilla and neighbouring districts over the alleged blasphemy. About 10 Hindu temples and shrines were attacked and vandalised by the crowds, who threw stones and smashed statues of the Hindu goddess Durga.

In Cumilla, police shot teargas and fired on the crowds. At least three people died at the scene and another later died of their injuries. Dozens, including several police officers, were injured.

On Friday, the prime minister, Sheikh Hasina promised severe action in response. “The incidents in Cumilla are being thoroughly investigated,” said Hasina. Nobody will be spared. It doesn’t matter which religion they belong to. They will be hunted down and punished.”

Md Faridul Haque Khan, the state minister for religious affairs, said the incident involving the Qur’an would be investigated but added that communal harmony should be protected and urged people not to take the law into their own hands.

Obaidul Quader, a minister with the ruling Awami League government, visited a Hindu shrine in the aftermath of the violence. He said that “fanatic elements” were responsible for the attacks on the Hindu religious festival, adding that the government would “not let them proceed with their evil design”.

The Bangladesh Hindu Unity Council said in a tweet that it “could not publish” what had happened over the past 24 hours, but stated that “the Hindus of Bangladesh saw the real faces of some people. We don’t know what will happen in the future. But the Hindus of Bangladesh will never forget Durga Puja in 2021”.

Hindu religious leaders alleged that the attacks were part of a conspiracy to attack the Hindu community of Bangladesh. Hindus make up 10% of the Muslim-majority country.

In August, four Hindu temples were attacked in the country’s Khulna district and in March, during a visit by Indian prime minister Narendra Modi, hardline Islamist groups attacked Hindu shrines.

The incident on Thursday prompted outrage in neighbouring Hindu-majority India. On Thursday, Indian government spokesperson Arindam Bagchi described the incident as “disturbing” and said officials were in communication with the Bangladesh authorities about the attacks."
https://www.theguardian.com/politics/2021/oct/16/united-nations-withdraws-matt-hancock-job-offer,"['job', 'appointment', 'united', 'uk', 'offer', 'uneca', 'nations', 'uns', 'hancock', 'websitemore', 'taken', 'withdraws', 'matt', 'withdrawnhancock', 'working', 'week']","Matt Hancock, the former UK health secretary, will no longer become a special envoy for the United Nations after the job offer was withdrawn.

Hancock had said he was “honoured” to be working with the UN’s Economic Commission for Africa to help the continent recover from the pandemic.

But campaigners objected to the appointment last week because of his record in government, and on Friday the UN’s official spokesman said the appointment “would not be taken forward”.

The UNECA has since removed the press release announcing Hancock’s appointment from its website.

More follows."
https://www.theguardian.com/news/2021/oct/16/nazanin-zaghari-ratcliffe-loses-latest-court-appeal-in-iran,"['release', 'plus', 'latest', 'mp', 'zaghariratcliffes', 'upheld', 'zaghariratcliffe', 'court', 'appeal', 'sentence', 'travel', 'iran', 'siddiq', 'nazanin', 'loses', 'prison']","Nazanin Zaghari-Ratcliffe has lost her latest appeal in Iran, meaning she could be sent back to prison “at any time”, her MP has said.

Labour MP Tulip Siddiq said Zaghari-Ratcliffe’s sentence of one year plus a one-year travel ban has been “upheld with no court hearing”.

The Hampstead and Kilburn MP has urged Boris Johnson to intervene in the case.

Siddiq tweeted on Saturday: “Just spoke to my constituent Nazanin Zaghari-Ratcliffe’s husband, Richard.

“Nazanin has lost her latest appeal and her sentence of 1 year plus 1 year travel ban is upheld with no court hearing. She could now be returned to prison at any time. The PM must act now to #FreeNazanin.”

Zaghari-Ratcliffe, a British-Iranian dual national, has been in custody in the country since 2016 after being accused of plotting to overthrow the government.

She was taking her daughter, Gabriella, to see her family when she was arrested and was sentenced to five years in jail shortly afterwards, spending four years in Tehran’s Evin prison.

She spent the final year of her sentence under house arrest in Tehran, but after her release this year was convicted of “spreading propaganda against the regime”.

Zaghari-Ratcliffe and her family have reportedly been told by Iranian authorities that she is being detained because of the UK’s failure to pay an outstanding £400m debt to Iran.

She is one of several people with British or dual-British nationality detained in Iran.

Her husband Richard Ratcliffe, Siddiq and Amnesty International have been campaigning for her release for several years.

Last month, the foreign secretary, Liz Truss, met her Iranian counterpart, Hossein Amir-Abdollahian, at the UN general assembly, where she “pressed” him on the issue and vowed to “continue to press” until Zaghari-Ratcliffe returns home.

The Foreign Office has been contacted for comment."
https://www.theguardian.com/world/2021/oct/16/four-russian-tourists-found-dead-albanian-beach-resort,"['staying', 'resort', 'think', 'week', 'dead', 'western', 'russian', 'village', 'albanian', 'tourists', 'staff', 'statement', 'surnames', 'russians']","Four Russian tourists have been found dead at a beach resort in western Albania, police have said.

Albanian police issued a statement on Saturday saying the tourists were found asphyxiated in a hotel sauna in the village of Qerret late on Friday.

Police did not give more details about the circumstances of the deaths, citing the continuing investigation. They said all of the hotel’s staff had been questioned.

The Russian tourists, aged between 31 and 60 years old, were part of a group that had been staying for a week at the five-star resort.

Investigators think the people who died may be members of the same family because of their surnames."
https://www.theguardian.com/world/2021/oct/16/revealed-newcastle-chairmans-links-to-saudi-anti-corruption-drive,"['mohammed', 'company', 'revealed', 'rumayyan', 'prince', 'saudi', 'crown', 'links', 'chairmans', 'documents', 'court', 'jet', 'anticorruption', 'newcastle', 'pif', 'drive']","Yasir al-Rumayyan, the new non-executive chairman of Newcastle United, was involved in a controversial “anti-corruption” campaign in Saudi Arabia that included the transfer of assets on behalf of the crown prince, Mohammed bin Salman.

Details of Rumayyan’s role – including the transfer of a charter jet company to the Public Investment Fund (PIF), where he serves as governor – are contained in court documents that shed light on his relationship with Prince Mohammed.

The inner workings of the PIF have been a source of intense interest after it led a consortium that acquired Newcastle United this month. The state-owned sovereign wealth fund is run by Rumayyan and chaired by the crown prince.

The Saudi-led consortium withdrew its bid to acquire Newcastle in 2020 amid concerns that the PIF was part the Saudi state. But the Premier League approved the deal this month and said it had been given “legally binding assurances that the Kingdom of Saudi Arabia will not control” the club. The Premier League has not disclosed the nature of the assurances.

Internal Saudi documents filed to a civil court in Canada as part of an unrelated case show that in 2017 a close aide to Prince Mohammed ordered Rumayyan – who is formally referred to in memos as “his excellency” and the “supervisor” of the PIF – to transfer 20 companies to the sovereign wealth fund as part of the anti-corruption campaign.

One of 20 seized companies, the documents show, was a charter jet company that was later alleged to have been used in the Saudi plot to kill Jamal Khashoggi. US intelligence agencies concluded in an intelligence report that was declassified in February that Prince Mohammed approved Khashoggi’s gruesome murder.

There is no suggestion that Rumayyan had any involvement in or knowledge of the alleged use of the jets in the operation that killed the Washington Post journalist.

The documents suggest, however, that a senior aide to the crown prince was able to order Rumayyan to take actions related to the PIF on Prince Mohammed’s behalf. The PIF declined to comment. A spokesperson for the Saudi embassy in Washington did not return a request for comment.

Rumayyan is a former banker who serves as governor of the PIF and chairman of the oil firm Saudi Aramco. He has overseen billions of dollars in investment by the PIF, including in Uber, Facebook, Disney and Citibank.

The Harvard Business School-educated executive is reportedly due to attend his first Newcastle match on Sunday in his new role as non-executive chairman of the club.

The internal Saudi documents were filed in a Canadian court as part of a civil case that has been brought by Saudi-owned entities against a former senior Saudi intelligence official, Saad Aljabri, a critic of Prince Mohammed who in turn has accused the Saudi government of trying to assassinate him in Canada. The Saudi government has denied the claims.

The court records include copies of memos that were sent to his “excellency the supervisor of the Public Investment Fund” by Mohammad al-Sheikh, a senior Saudi adviser to Prince Mohammed.

They relate to the infamous anti-corruption campaign led by the crown prince from November 2017, when 400 of Saudi Arabia’s richest individuals – including princes and ministers – were rounded up and held at the Ritz-Carlton hotel in Riyadh in what was later condemned by witnesses and critics as a purge involving torture, coercion and the expropriation of billions in assets into Saudi coffers.

Mohammad al-Sheikh, the close adviser to the crown prince, defended the campaign in a 2018 interview on CBS. “The anti-corruption crackdown was very simple. We had a serious problem with corruption,” he said. “We had to do what we did at the Ritz.”

The memos are labelled “top secret, not for circulation and very urgent”. The first memo, sent on 22 December 2017, calls on Rumayyan to “transfer” a number of companies to the PIF’s ownership that were seized as part of the anti-corruption purge.

The second memo, dated two days later, repeats the order with greater urgency and tells Rumayyan to “immediately approve the completion of the necessary procedures”.

Saudi documents filed to the court show that in response, Rumayyan sent a handwritten and signed memo on 26 December 2017 to an associate ordering him to “do what’s necessary as fast as possible” to comply with the order. Among the 20 companies included on a list to be transferred to the PIF was Sky Prime Aviation Services, a charter jet company based in Riyadh.

The name of the charter jet company resurfaced in 2019 in a report by Agnes Callamard, the former UN special rapporteur who investigated the Khashoggi killing. She concluded that the team of Saudi agents who killed the journalist used two jets operated by Sky Prime Aviation to travel to and from Istanbul before the murder in the Saudi consulate on October 2018.

CNN first reported in February 2021 that court documents showed that the two private jets used by the Saudi assassination squad were owned by a company that had previously been seized by Prince Mohammed. But other details from the court documents relating to Rumayyan’s role in PIF’s acquisition of the charter jet firm and other companies have not previously been reported.

The PIF declined to respond to a request for comment from Rumayyan and did not respond to a question about the control of Sky Prime Aviation Services. The Saudi embassy in Washington and the Premier League also declined to comment.

03:05 Obsessive, illuminating, high-stakes: why investigative journalism matters - video

Rumayyan has in the past described the abrupt manner in which he was selected by the crown prince to lead the PIF as governor in 2015. “I received a call … The crown prince heard of me. I got the call. I thought it was an interview [to lead the PIF], but it was, like: ‘Here is what I want you to do. One, two, three,’” Rumayyan said in a 2020 interview with the Carlyle Group chief executive, David Rubenstein.

After Rumayyan initially said he could start the job in three months, the crown prince told him he had “one month, and you will do it”. A week later Prince Mohammed called back and told Rumayyan he was starting “immediately”.

“We are all very proud to be Saudis and to participate in the positive changes the country is living and doing right now,” Rumayyan said in the Rubenstein interview."
